{
  "contract_version": "0.1.0",
  "task_id": "EXAMPLE-NOT-EXECUTED",
  "request_id": "EXAMPLE-REQUEST",
  "timezone": "Asia/Shanghai",
  "date_basis": "fixture_list_date",
  "scope": "ALL",
  "mode": "prediction",
  "date": "2026-09-10",
  "model_version": "HH520 V2.1-Test",
  "status": "CREATED",
  "asset_git_sha": null,
  "snapshot_id": null,
  "created_at": "2026-09-04T00:00:00+08:00"
}
